animeTitle	animeType	animeNumEpisode	releaseDate	endDate	animeNumMembers	animeScore	animeUsers	animeRank	animePopularity	animeDescription	animeRelated	animeCharacters	animeVoices	animeStaff	url
Duel Masters VSR	TV	51	2015-04-05 00:00:00	2016-03-27 00:00:00	1113	5.59	183	10108	10869	"A next fierce fight is about to begin after Katta Kirifuda finally become the Duel Masters National Tournament champion.

Japan's largest theme park, Duel Masters Land has appeared. With numerous fun attractions and events, Katta was also having fun.

However, after meeting the mascot of the park, ""Duemouse"", Katta got involved in a ridiculous conspiracy of the park.

A shadow that invades the Duel Masters World, which is the mysterious team of duelists! The mysterious identity of the legendary card is to be revealed. A new stage and revolution of Duel Masters befalls Katta!

(Source: Duel Masters Wikia)"	['Duel Masters VS', 'Duel Masters VSRF', 'Duel Masters: Hamukatsu to Dogiragon no Curry-pan Daibouken']	['Okabe, Tarou', 'Takigawa, Ruru', 'Kirifuda, Katta', 'Buke, Chatarou', 'Waramaki', 'Duemouse', 'Ochanomizu, Hiroshi', 'Lucifer', 'Akagiyama, Basara']	['Sugawara, Masayoshi', 'Tange, Sakura', 'Kobayashi, Yumiko', 'Ishino, Ryuuzou', 'Ishida, Akira', 'Kobayashi, Yuu', 'Sugiyama, Noriaki', 'Mizusawa, Fumie', 'Fukushima, Jun']	[['Sasaki, Shinobu', 'Director'], ['Itou, Fumio', 'Episode Director'], ['Pile', 'Theme Song Performance'], ['An Cafe', 'Theme Song Performance']]	https://myanimelist.net/anime/29687/Duel_Masters_VSR
