animeTitle	animeType	animeNumEpisode	releaseDate	endDate	animeNumMembers	animeScore	animeUsers	animeRank	animePopularity	animeDescription	animeRelated	animeCharacters	animeVoices	animeStaff
Yamiyo no Jidaigeki	Special	2	1995-02-19 00:00:00		328			14410	14323	"Tales include:

The Hill of Old Age, which tells of a conspiracy hatched against Japan's unifier, Oda Nobunaga. 

Seeing the Truth, about the assassin sent to murder Nobunaga's successor leyasu Tokugawa.

The broadcast was a part of the Neo Hyper Kids program. 

(Source: Anime Encyclopedia)"	['Yamiyo no Jidaigeki (OVA)']	[]	[]	[]
