animeTitle	animeType	animeNumEpisode	releaseDate	endDate	animeNumMembers	animeScore	animeUsers	animeRank	animePopularity	animeDescription	animeRelated	animeCharacters	animeVoices	animeStaff
Paper Cranes Story: Kenta to Maiko	OVA	1	2014-04-11 00:00:00		146			12715	17030	"Based on the picture eBook of the same name.

One by one, with feeling, the Thousand Paper Cranes are folded.
What if, those paper cranes had a ""life"" of their own...
The purpose given to the Thousand Paper Cranes!
The spectacular adventure of Kenta and Maiko begins now!!

(Source: dreamonefilm)"	[]	[]	[]	[]
