animeTitle	animeType	animeNumEpisode	releaseDate	endDate	animeNumMembers	animeScore	animeUsers	animeRank	animePopularity	animeDescription	animeRelated	animeCharacters	animeVoices	animeStaff	url
Fantascope: Tylostoma	OVA	1	2006-08-01 00:00:00		3157	6.75	938	4868	8251	"A man who appears every 700 years.
Streaching before the man's eyes the world rusted away to monochrome and gray.
Once before the town flourished that is now in ruins.
The man now, has a chance meeting with a person, a prositute.
A story of passion curling like smoke....Tairosu Tomah's story has begun.

(Source: Animenfo)"	[]	['Man', 'Goddess']	[]	[['Amano, Yoshitaka', 'Original Creator']]	https://myanimelist.net/anime/5802/Fantascope__Tylostoma
